{
  "schemaVersion": 4,
  "artifactKind": "release-qualification-evidence",
  "runtimeVersion": "1.0.0",
  "releaseTag": "v1.0.0",
  "finalMainCommit": "b88c230663eb96e0def8c869b095ea858b0ff50b",
  "releaseSourceAdmission": {
    "fileName": "release-source-admission-v3.json",
    "sizeBytes": 1939,
    "sha256": "6c4a7641a0a4cb20dfe52f39f9ef8fc12d8d8dae6eddea8b8eff9f66b1afbca8"
  },
  "hostConstruction": {
    "fileName": "hosted-host-construction-result-v2.json",
    "sizeBytes": 8646,
    "sha256": "376827de607ec5bbff283de2f86401bf9638ee5259af730f24d003db9261499e"
  },
  "modelManifestAdmission": {
    "fileName": "model-manifest-admission-v1.json",
    "sizeBytes": 1725,
    "sha256": "d176aced991a7eeea8076fd9fcb920f3b92043298de3ebd0794a1dcefa0ac00c"
  },
  "matrix": {
    "fileName": "current-release-matrix-v2.json",
    "sizeBytes": 2450,
    "sha256": "32510b0dfd6493a0c6066d309c361555791b5ecc2a5b5ace72fdadc85a52eebb"
  },
  "profiles": [
    {
      "profileId": "chinese",
      "hostArchive": {
        "fileName": "voice-host-chinese-darwin-arm64-1.0.0.zip",
        "sizeBytes": 9662381,
        "sha256": "d08bb4775ae1cc599679f3f2675ac81297ed5e6956aabe5c81ff45c2818dcea3"
      },
      "hostSourceClosureSha256": "705cb2a11ac9c1566344abf519a581747402a6ebc9336f45e1cc414deb4ec5f4",
      "hostSourceClosureSizeBytes": 701449,
      "hostDescriptorSha256": "0435c0867e0c74478e9f44cf75ab4d46e6de32aa45aab8bce30e0eee62448495",
      "hostFileManifestSha256": "e55cb44e863ed9760ba825538d88c7a292a5c4790e6834072b2b5e75819330af",
      "modelAdmissionRootSha256": "7a49df7e07d907818a02e3f5f12a58c47b5116d5e9deb2fd67caad1dcc97f0a8",
      "modelManifest": {
        "fileName": "voice-model-chinese-fun-asr-nano-gguf-q8-v1.json",
        "sizeBytes": 2801,
        "sha256": "09bf363a22ff7c98e53945e51544da09af0a96a7ad996b6ff991ef782a83c4da"
      },
      "compatibilityPairSha256": "ae45a451184c0660861f3900ef8bbb05b1c6cfd75cdefd04bbeb410e2e849795"
    },
    {
      "profileId": "english",
      "hostArchive": {
        "fileName": "voice-host-english-darwin-arm64-1.0.0.zip",
        "sizeBytes": 207493128,
        "sha256": "7149be2ebb28ae49e0e88df006e7de9446e9697c1e0b7ada91a82d77405fcbee"
      },
      "hostSourceClosureSha256": "d7cfe1ffad1c385492ae6e41283de598b4381b332c435cc2ee215c8b93768134",
      "hostSourceClosureSizeBytes": 40027,
      "hostDescriptorSha256": "dbfef7fa107a9b1304875ea85fcf3c7c08f88a5036ba70e0d450df2aec854665",
      "hostFileManifestSha256": "8ac5fe397f225efcbb035779b0172d56933de0c9c67d3aaff0587dbacda67256",
      "modelAdmissionRootSha256": "7cbf9799670b42482a29404c7a2acfb3a7f701a5e890d3cc22f3245bddfb5448",
      "modelManifest": {
        "fileName": "voice-model-english-whisper-small-mlx-fp16-v1.json",
        "sizeBytes": 2335,
        "sha256": "623ad1e90eb305e703f09a15e2325be2026aa39dea98bb34f1859ac953836593"
      },
      "compatibilityPairSha256": "d5a6b572df31561d06ae27bd6157d177bc251f57be8bbff6dd410884163fe53c"
    }
  ],
  "expectedAssetNames": [
    "THIRD_PARTY_NOTICES.json",
    "pretag-release-manifest-v4.json",
    "release-SHA256SUMS.txt",
    "release-qualification-evidence-v4.json",
    "voice-host-chinese-darwin-arm64-1.0.0.zip",
    "voice-host-english-darwin-arm64-1.0.0.zip",
    "voice-model-chinese-fun-asr-nano-gguf-q8-v1.json",
    "voice-model-english-whisper-small-mlx-fp16-v1.json",
    "voice-runtime-catalog-v4.json"
  ],
  "executionCounts": {
    "productTests": 0,
    "modelDownloads": 0,
    "providerLaunches": 0
  },
  "decision": "pass"
}
